{"kind":"postgresql-table-export","limits":{"max_output_bytes":1000,"max_rows":10,"statement_timeout_ms":1000,"wall_timeout_ms":2000},"observed":{"complete":true,"elapsed_ms":10,"local_rows":1,"output_bytes":18,"output_sha256":"10ab9aba6a1dc35799d9fb6cf2dc5e2862f926fa7e3ab3a61afc9b5591ce7362","server_rows":1},"plan_sha256":"860f04122536771328062b75b3689cf091ae35d743b6cf5bf587570cd0e0a633","postgres_source_receipt_version":2,"selection":{"format":"csv-utf8-v1","null_marker":"\\N","null_marker_collision":false,"sql":"SELECT \"id\", \"note\" FROM ONLY \"public\".\"order_lines\" ORDER BY \"id\""},"source":{"columns":["id","note"],"database":"database-a","primary_key":["id"],"role":"reader","role_bypassrls":false,"role_is_owner":false,"role_superuser":false,"schema":"public","server_version_num":160015,"source_id":"source-a","table":"order_lines","types":["int4","text"]},"transaction":{"client_encoding":"UTF8","date_style":"ISO, YMD","isolation":"repeatable read","read_only":true,"row_security":"off","snapshot":"1:2:","time_zone":"UTC"}}
